Jurisdiction,Publication Date,Publication Year,Application Number,Title,Abstract,Applicants,Inventors,Owners,Document_type,CPC_classification,IPCR Classifications,legal_status
WO,11/14/2019,2019,US 2019/0031340 W,ANALYSIS AND PRESENTATION OF AGRICULTURAL DATA,"A computer-implemented method is disclosed. The method comprises causing display of a first map of one or more agricultural fields, the first map indicating a first type of farming data; receiving cost data corresponding to a second type of farming data; receiving revenue data; performing an RoI analysis for the one or more agricultural fields having a plurality of components, including cost data associated with a third type of farming data, the revenue data, and corresponding RoI data; causing display of a second map of the one or more agricultural fields concurrently with the first map, the second map indicating a first component of the RoI analysis; receiving a selection of points from the second map, the selection corresponding to a boundary of a region within the one or more agricultural fields; causing display of a report indicating the first component of the RoI analysis specific to the region.",CLIMATE CORP,BONES TAVIS;;STUBER JAKOB;;PLATTNER KYLE;;MERRYMAN JOSHUA;;LISKER ORIANA;;SAUDER DOUG;;BARRON CHRISTOPHER H,,Patent Application,G06Q40/12;;G06Q50/02;;A01B79/005;;G06Q50/02;;G06Q40/12;;G06F16/29,G06Q10/06;;G06Q10/08;;G06Q50/02,PENDING,,,,
US,1/30/2020,2020,US 201916547151 A,VEHICLE CONTROLLERS FOR AGRICULTURAL AND INDUSTRIAL APPLICATIONS,"Systems and methods for vehicle controllers for agricultural and industrial applications are described. For example, a method includes receiving image data, captured using one or more image sensors connected to a vehicle, depicting one or more plants in a vicinity of the vehicle; detecting the one or more plants based on the image data; responsive to detecting the one or more plants, adjusting implement control data; and controlling, based on the adjusted implement control data, an implement connected to the vehicle to perform an operation on the one or more plants.",BEAR FLAG ROBOTICS INC,BERTUCCI DAVID E;;CAFIERO IGINO C;;DONNELLAN AUBREY C;;NGUYEN THUY T;;VISWANATHAN VAIBHAV K,BEAR FLAG ROBOTICS INC (2019-02-15),Patent Application,A01B69/001;;A01B69/008;;A01B79/005;;G05D1/0274;;G05D2201/0201;;G05D1/0248;;G06V20/58;;G06V10/757;;G06V2201/06;;A01B79/005;;G06T7/70;;G05D1/0212;;G05D1/0276;;G05D1/0088;;G06T2207/30252;;G06F16/29;;G06T2207/30188;;G05D2201/0201;;G06T2207/10028;;G06V20/56;;G06F18/2113;;G05D1/0274;;G06V10/757;;G06V20/58,A01B79/00;;G05D1/00;;G05D1/02;;G06F16/29;;G06K9/00;;G06K9/62;;G06T7/70,ACTIVE,,,,
US,4/27/2023,2023,US 202217942069 A,Digital-Twin-Enabled Digital Product Network System,"A digital product network system includes a set of digital products each having a product memory, a product network interface, and a product processor programmed with product instructions. The digital product network system includes a product network control tower having a control tower memory, a control tower network interface, and a control tower processor programmed with control tower instructions. The digital product network system includes a digital twin system defined at least in part by at least one of the product instructions or the control tower instructions to encode a set of digital twins representing the set of digital products",STRONG FORCE VCN PORTFOLIO 2019 LLC,CELLA CHARLES HOWARD;;CARDNO ANDREW;;PARENTI JENNA;;LOCKE ANDREW S,STRONG FORCE VCN PORTFOLIO 2019 LLC (2022-12-02),Patent Application,G06Q10/08;;G05B13/048;;G05B23/0283;;G06Q10/04;;G06Q10/087;;G06Q10/067;;G06Q30/0201;;G06Q30/0202,G06Q10/06;;G06Q10/08;;G06Q30/02,PENDING,,,,
US,10/30/2018,2018,US 201314023351 A,Generating a crop recommendation,"In a method of for generating a crop recommendation, a plurality of data sets are received by a computer system from a plurality of disparate data sources, wherein each of said plurality of data sets describes a factor affecting a crop. A benchmark is created by the computer system for each of the data sets which describes how the factor affects the market value of the crop. A model is generated by the computer system which describes the crop based upon each of said benchmarks from the plurality of data sets. A report is then generated by the computer system comprising at least one recommendation to increase the market value of the crop.",TRIMBLE INC,LINDORES ROBERT JAMES,TRIMBLE NAVIGATION LIMITED (2013-08-29);;TRIMBLE INC (2016-09-30),Granted Patent,A01C21/007;;A01B79/005;;A01B79/005;;A01C21/00;;G06Q40/04;;G06Q50/02,G06Q40/04;;A01B79/00;;A01C21/00;;G06Q50/02,ACTIVE,,,,
US,3/22/2022,2022,US 201916547151 A,Vehicle controllers for agricultural and industrial applications,"Systems and methods for vehicle controllers for agricultural and industrial applications are described. For example, a method includes receiving image data, captured using one or more image sensors connected to a vehicle, depicting one or more plants in a vicinity of the vehicle; detecting the one or more plants based on the image data; responsive to detecting the one or more plants, adjusting implement control data; and controlling, based on the adjusted implement control data, an implement connected to the vehicle to perform an operation on the one or more plants.",BEAR FLAG ROBOTICS INC,BERTUCCI DAVID E;;CAFIERO IGINO C;;DONNELLAN AUBREY C;;NGUYEN THUY T;;VISWANATHAN VAIBHAV K,BEAR FLAG ROBOTICS INC (2019-02-15),Granted Patent,A01B69/001;;A01B69/008;;A01B79/005;;G05D1/0274;;G05D2201/0201;;G05D1/0248;;G06V20/58;;G06V10/757;;G06V2201/06;;A01B79/005;;G06T7/70;;G05D1/0212;;G05D1/0276;;G05D1/0088;;G06T2207/30252;;G06F16/29;;G06T2207/30188;;G05D2201/0201;;G06T2207/10028;;G06V20/56;;G06F18/2113;;G05D1/0274;;G06V10/757;;G06V20/58,G01C22/00;;A01B69/00;;A01B79/00;;B62D6/00;;B62D11/00;;B62D12/00;;B63G8/20;;B63H25/04;;G05D1/00;;G05D1/02;;G06F7/00;;G06F16/29;;G06F17/00;;G06K9/00;;G06K9/62;;G06T7/70,ACTIVE,,,,
US,12/7/2021,2021,US 201716324981 A,System and method for drone fleet management for harvesting and dilution,"The present invention provides a management system for autonomous unmanned aircraft vehicle (UAV) fleet management for harvesting or diluting fruits, and a computerized method for optimal harvesting using a UAV fleet.",TEVEL AEROBOTICS TECH LTD;;TEVEL ADVANCED TECH LTD,MAOR YANIV,TEVEL AEROBOTICS TECHNOLOGIES LTD (2019-02-03),Granted Patent,A01D46/253;;B64D1/22;;A01D46/30;;B64C39/024;;G05D1/0094;;B64U2201/10;;B64U2101/00;;A01D46/30;;A01D46/253;;B64C39/00;;A01D46/253;;B64D1/22;;G06F16/29;;G05D1/106;;A01G3/085;;A01G25/16;;B64D47/08;;G05D1/0094;;G06V20/188;;B64U10/13;;B64U2101/00;;B64U2101/30;;B64U2101/60;;B64U2201/10;;B64U2201/102;;B64U2201/104;;A01D46/30;;G06F16/587;;B64C39/024;;G05D1/0022;;G06T5/50;;G05D1/104;;G08G5/0069;;G08G5/0073,G05D1/10;;A01D46/253;;A01D46/30;;A01G3/08;;A01G25/16;;B64C39/02;;B64D1/22;;B64D47/08;;G05D1/00;;G06F16/29;;G06F16/587;;G06K9/00;;G06K9/20;;G06T5/50;;G08G5/00,ACTIVE,,,,
US,2/17/2022,2022,US 202117404470 A,SITE CHARACTERIZATION FOR AGRICULTURE,"Methods, systems, and apparatus, including computer programs encoded on computer storage media, for characterization of a physical site. One of the methods includes obtaining, for each of one or more physical locations corresponding to a respective coordinate at a surface of a growing medium at the locations, sensor data comprising a sensor profile generated from measurements taken by each of a plurality of sensors on a sensor unit passing through the respective coordinate at a plurality of different depth levels within the growing medium at the location; providing the sensor data as input to one or more probabilistic models configured to receive the sensor data comprising the respective sensor profiles to predict one or more characteristics of the growing medium at each of the physical locations; and obtaining, as output from the one or more probabilistic models, the one or more predicted characteristics for each physical location.",LANDSCAN LLC,ROONEY DANIEL JAMES;;FARRINGTON STEPHEN;;DLOTT JEFFERY WINGET;;WALLACE WOODY GUTHRIE,LANDSCAN LLC (2022-08-24),Patent Application,G06Q10/04;;G06Q50/02;;G06Q10/06315;;G06Q30/0205;;G06Q50/02;;G06N7/01,G06N7/00;;G06Q10/06;;G06Q30/02;;G06Q50/02,PENDING,,,,
US,11/14/2019,2019,US 201815976574 A,ANALYSIS AND PRESENTATION OF AGRICULTURAL DATA,"A computer-implemented method of managing data related to an agricultural process is disclosed. The method comprises causing, by a processor, display of a first map of one or more agricultural fields, the first map indicating a first type of a plurality of types of farming data associated with the one or more agricultural fields; receiving, by the processor, cost data corresponding to a second type of the plurality of types of farming data associated with the one or more agricultural fields; receiving revenue data associated with the one or more agricultural fields; performing a return-on-investment (RoI) analysis for the one or more agricultural fields having a plurality of components, including cost data associated with a third type of the plurality of types of farming data, the revenue data, and corresponding RoI data; causing display of a second map of the one or more agricultural fields concurrently with the first map, the second map indicating a first component of the plurality of components of the RoI analysis; receiving a selection of points from the second map, the selection corresponding to a boundary of a region within the one or more agricultural fields; causing display of a report indicating the first component of the RoI analysis specific to the region.",CLIMATE CORP,BONES TAVIS;;STUBER JAKOB;;PLATTNER KYLE;;MERRYMAN JOSHUA;;LISKER ORIANA;;SAUDER DOUG;;BARRON CHRISTOPHER H,CLIMATE LLC (2018-05-09),Patent Application,G06Q40/12;;G06Q50/02;;A01B79/005;;G06Q50/02;;G06Q40/12;;G06F16/29,G06Q50/02;;G06Q40/00,ACTIVE,,,,
US,8/25/2020,2020,US 201815976574 A,Analysis and presentation of agricultural data,"A computer-implemented method of managing data related to an agricultural process is disclosed. The method comprises causing, by a processor, display of a first map of one or more agricultural fields, the first map indicating a first type of a plurality of types of farming data associated with the one or more agricultural fields; receiving, by the processor, cost data corresponding to a second type of the plurality of types of farming data associated with the one or more agricultural fields; receiving revenue data associated with the one or more agricultural fields; performing a return-on-investment (RoI) analysis for the one or more agricultural fields having a plurality of components, including cost data associated with a third type of the plurality of types of farming data, the revenue data, and corresponding RoI data; causing display of a second map of the one or more agricultural fields concurrently with the first map, the second map indicating a first component of the plurality of components of the RoI analysis; receiving a selection of points from the second map, the selection corresponding to a boundary of a region within the one or more agricultural fields; causing display of a report indicating the first component of the RoI analysis specific to the region.",CLIMATE CORP,BONES TAVIS;;STUBER JAKOB;;PLATTNER KYLE;;MERRYMAN JOSHUA;;LISKER ORIANA;;SAUDER DOUG;;BARRON CHRISTOPHER H,CLIMATE LLC (2018-05-09),Granted Patent,G06Q40/12;;G06Q50/02;;A01B79/005;;G06Q50/02;;G06Q40/12;;G06F16/29,G06Q50/02;;G06F16/29;;G06Q40/00,ACTIVE,,,,
EP,6/2/2021,2021,EP 15866521 A,AUTOMATIC TARGET RECOGNITION AND DISPENSING SYSTEM,,UNIV SYDNEY,CALLEIJA MARK;;SUKKARIEH SALAH,"AGERRIS PTY LTD, CHIPPENDALE, AU (2021-09-03)",Granted Patent,A01M7/006;;A01M7/0089;;A01M21/043;;A62C37/40;;A01G25/09;;B64D1/18;;B64C39/024;;B64D47/08;;A01B79/005;;B64U2101/30;;B64U2101/00;;A01M7/006;;A01M7/0089;;A01M21/043;;A62C37/40;;A01G25/09;;B64D1/18;;B64C39/024;;B64D47/08;;B64U2101/00;;B64U2101/30;;A01B79/005,A01B76/00;;A01C23/00;;A62C37/08;;B64C39/02;;B64D1/02;;B64D1/16;;B64D47/08,ACTIVE,,,,
WO,2/15/2018,2018,US 2017/0044040 W,ESTIMATING NITROGEN CONTENT USING HYPERSPECTRAL AND MULTISPECTRAL IMAGES,"In an approach, hyperspectral and/or multispectral remote sensing images are automatically analyzed by a nitrogen analysis subsystem to estimate the value of nitrogen variables of crops or other plant life located within the images. For example, the nitrogen analysis subsystem may contain a data collector module, a function generator module, and a nitrogen estimator module. The data collector module prepares training data which is used by the function generator module to train a mapping function. The mapping function is then used by the nitrogen estimator module to estimate the values of nitrogen variables for a new remote sensing image that is not included in the training set. The values may then be reported and/or used to determine an optimal amount of fertilizer to add to a field of crops to promote plant growth.",CLIMATE CORP,GUAN WEI;;XU YING,,Patent Application,A01G7/00;;A01C21/007;;G06V20/188;;G06V10/7715;;A01C21/007;;A01G22/00;;A01G7/00;;G06V20/188;;G06V10/7715,G01J3/28;;G06K9/00;;G06T7/00;;G06T7/40,PENDING,,,,
US,1/31/2023,2023,US 202016845052 A,Leveraging feature engineering to boost placement predictability for seed product selection and recommendation by field,"An example computer-implemented method includes receiving a plurality of agricultural data records including yield properties of products grown in fields and raw field features of the fields. The method also includes transforming the raw field features into distinct feature classes that characterize key features affecting yield of the one or more products, and generating, using data from the plurality of agricultural data records and the distinct feature classes, genomic-by-environmental relationships between one or more products, yield properties of the one or more products, and field features associated with the one or more products. Further, the method includes generating, based at least in part on the genomic-by-environmental relationships, predicted yield performance for a set of products associated with one or more target environments, generating product recommendations for the one or more target environments based on the predicted yield performance for the set of products, and providing one or more instructions configured to cause display of the product recommendations.",CLIMATE LLC,JIANG DONGMING;;SSEGANE HERBERT;;SOOD SHILPA;;YANG XIAO;;WANG XUEFEI,CLIMATE LLC (2019-04-12),Granted Patent,G06Q50/02;;G16B20/00;;A01B79/005;;G06N20/10;;G06N20/20;;G06N3/126;;G06N3/006;;G06N5/01;;G06Q30/0631;;G06F16/2462;;G06Q50/02;;A01B79/005;;G06N20/00;;G16B20/00;;G06N7/01,G06Q30/06;;A01B79/00;;G06F16/2458;;G06N7/00;;G06N20/00;;G06Q50/02;;G16B20/00,ACTIVE,,,,
WO,3/30/2017,2017,US 2016/0051492 W,PONDING WATER DETECTION ON SATELLITE IMAGERY,"In an approach, an image of an agricultural field is analyzed using a classifier that has been trained to identify a probability for each pixel within an image that the pixel corresponds to water. A flow simulation is performed to determine regions of the field that are likely to pool water after rainfall based on precipitation data, elevation data, and soil property data of the field. A graph of vertices representing the pixels and edges representing connections between neighboring pixels is generated. The probability of each pixel within the graph being ponding water is set based on the probability pixel being water, the likelihood that water will pool in the area represented by the pixel, the probability of neighboring pixels being ponding water, and a cropland mask that identifies which pixels correspond to cropland. A class for each pixel is then determined that maximizes the joint probability over the graph.",CLIMATE CORP,WEI GUAN;;KHADKA PRAMITHUS,,Patent Application,G06V20/194;;G06V20/188;;A01G7/00;;G06T7/00;;G06T3/0031;;G06V20/188;;G06V20/194,G06K9/46;;G06K9/62,PENDING,,,,
US,4/7/2020,2020,US 201816222910 A,Estimating nitrogen content using hyperspectral and multispectral images,"In an approach, hyperspectral and/or multispectral remote sensing images are automatically analyzed by a nitrogen analysis subsystem to estimate the value of nitrogen variables of crops or other plant life located within the images. For example, the nitrogen analysis subsystem may contain a data collector module, a function generator module, and a nitrogen estimator module. The data collector module prepares training data which is used by the function generator module to train a mapping function. The mapping function is then used by the nitrogen estimator module to estimate the values of nitrogen variables for a new remote sensing image that is not included in the training set. The values may then be reported and/or used to determine an optimal amount of fertilizer to add to a field of crops to promote plant growth.",CLIMATE CORP,GUAN WEI;;XU YING,,Granted Patent,A01G7/00;;A01C21/007;;G06V20/188;;G06V10/7715;;A01C21/007;;A01G22/00;;A01G7/00;;G06V20/188;;G06V10/7715,G06K9/00;;A01C21/00;;A01G7/00;;A01G22/00,ACTIVE,,,,
WO,2/22/2018,2018,IL 2017050917 W,SYSTEM AND METHOD FOR DRONE FLEET MANAGEMENT FOR HARVESTING AND DILUTION,"The present invention provides a management system for autonomous unmanned aircraft vehicle (UAV) fleet management for harvesting or diluting fruits, and a computerized method for optimal harvesting using a UAV fleet.",TEVEL ADVANCED TECH LTD,MAOR YANIV,,Patent Application,A01D46/253;;B64D1/22;;A01D46/30;;B64C39/024;;G05D1/0094;;B64U2201/10;;B64U2101/00;;A01D46/30;;A01D46/253;;B64C39/00;;A01D46/253;;B64D1/22;;G06F16/29;;G05D1/106;;A01G3/085;;A01G25/16;;B64D47/08;;G05D1/0094;;G06V20/188;;B64U10/13;;B64U2101/00;;B64U2101/30;;B64U2101/60;;B64U2201/10;;B64U2201/102;;B64U2201/104;;A01D46/30;;G06F16/587;;B64C39/024;;G05D1/0022;;G06T5/50;;G05D1/104;;G08G5/0069;;G08G5/0073,A01D46/24;;A01D46/253;;A01D46/30;;B64C39/00;;B64C99/00,PENDING,,,,
US,9/21/2021,2021,US 202016841995 A,Estimating nitrogen content using hyperspectral and multispectral images,"In an approach, hyperspectral and/or multispectral remote sensing images are automatically analyzed by a nitrogen analysis subsystem to estimate the value of nitrogen variables of crops or other plant life located within the images. For example, the nitrogen analysis subsystem may contain a data collector module, a function generator module, and a nitrogen estimator module. The data collector module prepares training data which is used by the function generator module to train a mapping function. The mapping function is then used by the nitrogen estimator module to estimate the values of nitrogen variables for a new remote sensing image that is not included in the training set. The values may then be reported and/or used to determine an optimal amount of fertilizer to add to a field of crops to promote plant growth.",CLIMATE CORP,GUAN WEI;;XU YING,,Granted Patent,A01G7/00;;A01C21/007;;G06V20/188;;G06V10/7715;;A01C21/007;;A01G22/00;;A01G7/00;;G06V20/188;;G06V10/7715,G06K9/00;;A01C21/00;;A01G7/00;;A01G22/00,ACTIVE,,,,
WO,9/30/2021,2021,CN 2020081394 W,METHOD AND SYSTEM OF ANTENNA MEASUREMENT FOR MOBILE COMMUNICATION BASE STATION,"A method and system for mobile communication base station antenna measurement is disclosed. The method comprises steps of: acquiring a set of images containing antennas of a base station; processing the set of images with a model based on instance segmentation network, and generating visualized images corresponding to the set of images of antennas; calculating, from the visualized images, the quantity of antennas of the base station and separating data for each antenna; measuring parameters of each antenna by data fitting. The system comprises a processor and a memory storing program instructions thereon, the program instructions executable by the processor to cause the system to perform the steps of the method.",UNIV WUYI,ZHAI YIKUI;;KE QIRUI;;GAN JUNYING;;DENG WENBO;;XU YING;;ZENG JUNYING;;YING ZILU;;ZHOU WENLUE;;ZHI YIHANG;;WU XI,,Patent Application,G06T7/0002;;G06T7/11;;G06T7/194;;G06T7/143;;G06T7/73;;G06T2207/30242;;G06T2207/20081;;G06T2207/10032;;G06T2207/20076;;G06T2207/10016;;G06V20/176;;G06V10/82;;G06N3/08;;G06T2207/20084;;G06N3/045,G06K9/62;;G06T7/00;;G06N3/04,PENDING,,,,
WO,12/19/2019,2019,CA 2019050834 W,"DEVICES, SYSTEMS AND METHODS FOR MULTIVARIABLE OPTIMIZATION OF PLANT GROWTH AND GROWTH OF OTHER PHOTOTROPHIC ORGANISMS","The present disclosure relates to devices, systems and methods for multivariable optimization of plant growth and growth of other phototrophic organisms. In one aspect, the method comprises: generating a set of growing states as an initial population, each growing state defining a set of plant parameters measurable by one or a combination of plant growth sensors and environmental parameters measurable by one or a combination of environmental sensors; determining a fitness of each of the growing states via a fitness function; selecting a plurality of individual growing states for a subsequent generation; generating a plurality of new growing states by performing a crossover of the selected individual growing states via a crossover algorithm; and outputting an optimized growing state in response to a determination that the population has converged.",PAIGE GROWTH TECH INC,MARTIN STEVEN;;GONZALEZ JAIME;;DI PIETRO EMIDIO;;DI PIETRO TONY;;HINDS DADRIAN;;ANDRADE KEVIN,,Patent Application,G06Q50/02;;G01N21/65;;G01N15/06;;G06Q10/0639;;A01G9/249;;A01G9/246;;A01G9/18;;A01G9/006;;A01G9/143;;G01N21/31;;G01N2021/8466;;G01N21/6486;;G01N2015/0046;;G01N2015/0065;;G06N3/126;;G06N3/084;;G01N33/0098;;Y02A40/10;;Y02A40/25;;G06N3/047;;G06N3/045,G06Q50/02;;A01G7/00;;G06Q10/04,PENDING,,,,
WO,4/8/2021,2021,EP 2020077197 W,"QUANTIFYING OBJECTS ON PLANTS BY ESTIMATING THE NUMBER OF OBJECTS ON PLANT PARTS SUCH AS LEAVES, BY CONVOLUTIONAL NEURAL NETWORKS THAT PROVIDE DENSITY MAPS","Quantifying plant infestation is performed by estimating the number of biological objects (132) on parts (122) of a plant (112). A computer (202) receives a plant-image (412) taken from a particular plant (112). The computer (202) uses a first convolutional neural network (262/272) to derive a part-image (422) that shows a part of the plant. The computer (202) splits the part-image into tiles and uses a second network to process the tiles to density maps. The computer (202) combines the density maps to a combined density map in the dimension of the part-image and integrates the pixel values to an estimate number of objects for the part. Object classes (132(1), 132(2)) can be differentiated to fine-tune the quantification to identify class-specific countermeasures.",BASF SE,ALVAREZ GILA AITOR;;ORTIZ BARREDO AMAIA MARIA;;ROLDAN LOPEZ DAVID;;ROMERO RODRIGUEZ JAVIER;;SPANGLER CORINNA MARIA;;KLUKAS CHRISTIAN;;EGGERS TILL;;ECHAZARRA HUGUET JONE;;NAVARRA MESTRE RAMON;;PICON RUIZ ARTZAI;;BERECIARTUA PEREZ ARANZAZU,,Patent Application,G06N3/082;;G06N3/045;;G06F18/2414;;G06N3/082;;G06N20/10;;G06V20/10;;G06V10/454;;G06V10/56;;G06V10/82;;G06V10/764;;G06N3/048;;G06N3/045;;G06N3/082;;G06V10/56;;G06V10/764;;G06V10/82;;G06V10/454;;G06V20/10;;G06T7/11;;G06V10/762;;G06T7/0012;;G06T2207/20081;;G06T2207/20084,G06K9/00;;G06K9/46;;G06K9/62,PENDING,,,,
US,6/26/2018,2018,US 201715661192 A,Systems and methods for detecting soil characteristics,"A soil detection and planting apparatus. The apparatus includes a vehicle and a controller coupled to the vehicle. The apparatus further includes a planting device coupled to the vehicle, the planting device configured to plant seeds or plants into a soil material. The apparatus includes a ground penetrating radar sensor coupled to the vehicle. The ground penetrating radar soil sensor is configured to scan the soil material up to a designated depth beneath a surface of the soil material, wherein the ground penetrating radar soil sensor is further configured to provide a sensor feedback signal to the controller with respect to an intrinsic characteristic of the soil material. The controller is configured to instruct placement of a seed or a plant into the soil material based on the feedback signal.",ELWHA LLC,CHAN ALISTAIR K;;DUNCAN WILLIAM DAVID;;HYDE RODERICK A;;WOOD JR LOWELL L,,Granted Patent,A01B69/00;;A01B79/005;;A01B79/005;;A01C7/085;;A01C7/102;;A01C21/005;;A01C21/005;;A01C23/04;;A01G25/167;;B64D1/18;;B64D43/00;;G01S13/89;;G01S13/89;;G01S7/412;;G01S7/412;;G01S13/885;;G01S13/885;;G01S13/887;;G01S13/888;;G01S15/89,G01S13/89;;A01B69/00;;A01C7/08;;A01C7/10;;A01C23/04;;A01G25/16;;B64D1/18;;B64D43/00;;G01S13/88;;G01S15/89,INACTIVE,,,,
