Jurisdiction,Publication Date,Publication Year,Application Number,Title,Abstract,Applicants,Inventors,Owners,Document_type,CPC_classification,IPCR Classifications,legal_status
WO,10/20/2022,2022,US 2022/0025103 W,"SYSTEMS, METHODS, KITS, AND APPARATUSES FOR DIGITAL PRODUCT NETWORK SYSTEMS AND BIOLOGY-BASED VALUE CHAIN NETWORKS","A digital product network system generally includes a set of digital products each having a product memory, a product network interface, and a product processor programmed with product instructions; a product network control tower having a control tower memory, a control tower network interface, and a control tower processor programmed with control tower instructions; and a digital twin system defined at least in part by at least one of the product instructions or the control tower instructions to encode a set of digital twins representing the set of digital products.",STRONG FORCE VCN PORTFOLIO 2019 LLC,CELLA CHARLES;;CARDNO ANDREW;;PARENTI JENNA;;LOCKE ANDREW;;KELL BRAD;;EL-TAHRY TEYMOUR;;GOODMAN BENJAMIN;;FORTIN JR;;BUNIN ANDREW;;SHARMA KUNAL;;CHARON TAYLOR;;MALCHEV HRISTO,,Patent Application,G06Q10/08;;G05B13/048;;G05B23/0283;;G06Q10/04;;G06Q10/087;;G06Q10/067;;G06Q30/0201;;G06Q30/0202,G06Q10/08;;G06F9/451,PENDING,,,,
US,9/12/2017,2017,US 201615055185 A,System and method for application of materials through coordination with automated data collection vehicles,"An agricultural material application management system includes an automated agricultural data collection vehicle including a location sensor. The automated agricultural data collection vehicle includes a receiver that receives sensor data including crop information, a memory that stores the plurality of locations and the sensor data, and a processor that generates a mapping correlating the crop information with the plurality of locations in the agricultural area, and generates an agricultural material application recommendation for each of the plurality of locations based on the mapping. The agricultural material application management system includes an agricultural vehicle including an interface unit that interfaces with the automated agricultural data collection vehicle and receives the agricultural material application recommendations from the agricultural data collection vehicle. An agricultural material applicator applies an agricultural material to at least some of the plurality of locations, and a display provides the recommendations to a driver of the agricultural vehicle.",IBM,BARBOSA LUCIANO DE ANDRADE;;KORMAKSSON MATTHIAS;;DOS SANTOS CICERO NOGUEIRA;;DOS SANTOS MARCELO NERY;;ZADROZNY BIANCA,INTERNATIONAL BUSINESS MACHINES CORPORATION (2016-02-04),Granted Patent,A01B79/005;;A01C21/007;;B64C39/024;;B64U2101/00;;A01B79/005;;A01C21/007;;B64C39/024;;B64U2101/00,G01C23/00;;A01B79/00;;A01C21/00;;B64C39/02,ACTIVE,,,,
WO,1/14/2021,2021,US 2020/0041270 W,IRRIGATION CONTROL WITH DEEP REINFORCEMENT LEARNING AND SMART SCHEDULING,"Disclosed are various embodiments for deep reinforcement learning-based irrigation control to maintain or increase crop yield and/or other desired crop status, and/or reduce water use. One or more computing devices can be configured to determine an amount of water to be applied to at least one crop in at least one of a plurality of irrigation management zones through execution of a deep reinforcement learning routine. Further, the computing devices can determine a start time and an end time to be applied to the at least one of the plurality of irrigation management zones based at least in part on the amount of water determined by the deep reinforcement learning module. Finally, the computing devices can instruct an irrigation system to apply irrigation to the at least one of the plurality of irrigation management zones in accordance with the start time and the end time.",TEXAS A & M UNIV SYS,YANG YANXIANG;;KONG HONGXIN;;HU JIANG;;PORTER DANA;;MAREK THOMAS;;HEFLIN KEVIN,,Patent Application,G06N3/08;;A01G25/167;;G06N3/006;;G06N20/00;;G06N7/01;;A01G25/165;;A01G25/167;;B64C39/024;;G05B13/027;;B64U2101/30,A01G25/16;;A01G25/00;;G05D7/00;;G06N3/02;;G06N3/08,PENDING,,,,
US,10/6/2022,2022,US 202217683120 A,Robot Fleet Resource Configuration in Value Chain Networks,"A robot fleet management platform includes a job configuration system that determines tasks to be performed by robots of a robot fleet based on a job request and a first fleet objective. A proxy service applies fleet configuration services to the tasks to produce a data structure. An intelligence layer activates intelligence services to produce a robot task and associated contextual information that facilitates robot selection and task ordering. A job workflow system generates a workflow defining a performance order of the tasks. A workflow simulation system simulates performance of the job request based on the workflow to recursively redefine the tasks, the data structure, or the workflow until the simulation result satisfies a second fleet objective. In response to the simulation result satisfying the set of fleet objectives, a plan generator generates a job execution plan based on the set of robot tasks, the data structure, and the workflow.",STRONG FORCE VCN PORTFOLIO 2019 LLC,CELLA CHARLES H;;KELL BRAD;;EL-TAHRY TEYMOUR S;;CARDNO ANDREW;;FORTIN LEON,,Patent Application,Y02P80/10;;Y02P80/40;;G05D1/0297;;G05D2201/0216;;G05D1/0221;;G05B19/4099;;G05B17/02;;G05B2219/49023;;G05B2219/36252;;G02B3/14;;G06N3/006;;G06N3/088;;G06N3/084;;G06N20/10;;G06N5/025;;B33Y50/02;;G06N3/045;;G05B2219/49023;;G05B19/4099;;G06N20/20;;G02B3/14;;G02B26/00;;G05B17/02;;G05D1/0297;;B25J9/161;;B25J9/163;;B25J9/1653;;B25J9/1697;;B33Y10/00;;B33Y50/02;;B29C64/393;;G06N20/00;;H04L9/50;;H04L9/3239;;G06Q10/06311;;G06F30/27;;G06F2113/10;;G05B13/0265;;G05B13/042;;G06Q30/0201;;G05D1/0027;;G06Q10/0631;;G06Q10/0831;;G06Q10/0833;;G06Q10/087;;B25J9/1661;;B25J9/1671;;B25J9/1682;;G06Q10/06;;G06Q10/0633;;G06Q10/06313;;G06Q20/14,G06Q10/06,PENDING,,,,
US,4/30/2020,2020,US 201916662023 A,DETECTING INFECTION OF PLANT DISEASES WITH IMPROVED MACHINE LEARNING,"A system and processing methods for refining a convolutional neural network (CNN) to capture characterizing features of different classes are disclosed. In some embodiments, the system is programmed to start with the filters in one of the last few convolutional layers of the initial CNN, which often correspond to more class-specific features, rank them to hone in on more relevant filters, and update the initial CNN by turning off the less relevant filters in that one convolutional layer. The result is often a more generalized CNN that is rid of certain filters that do not help characterize the classes.",CLIMATE CORP,SHE YING;;GUAN WEI,CLIMATE LLC (2019-11-01),Patent Application,G06N3/08;;G06N20/20;;G06N3/126;;G06V10/82;;G06V20/60;;G06V10/771;;G06V10/776;;G06N3/045;;G06F18/2113;;G06N3/04;;G06N3/08;;G06V20/68;;G06N3/086;;G06F18/2113;;G06F18/217;;G06F18/2431;;G06N5/01;;G06V10/771;;G06V10/776;;G06V10/82;;G06V20/60,G06K9/62;;G06N3/04;;G06N3/08;;G06N5/00,ACTIVE,,,,
US,3/7/2023,2023,US 201816102577 A,Digital nutrient models using spatially distributed values unique to an agronomic field,"In an embodiment, an agricultural intelligence computing system stores a digital model of crop growth, the digital model of crop growth being configured to compute nutrient requirements in soil to produce particular yield values based, at least in part, on data unique to an agricultural field. The system receives agronomic field data for a particular agronomic field, the agronomic field data comprising one or more input parameters for each of a plurality of locations on the agronomic field, nutrient application values for each of the plurality of locations, and measured yield values for each of the plurality of locations. The system computes, for each location of the plurality of locations, a required nutrient value indicating a required amount of nutrient to produce the measured yield values. The system identifies a subset of the plurality of locations where the computed required nutrient value is greater than the nutrient application value. The system computes, for each of the subset of the plurality of locations, a residual value comprising a difference between the required nutrient value and the nutrient application value. The system generates a residual map comprising the residual values at the subset of the plurality of locations. Using the residual map and the one or more input parameters for each of the plurality of locations, the system generates and stores particular model correction data for the particular agronomic field.",CLIMATE LLC,ARRIAZA JUAN LOPEZ;;GATES JOHN,CLIMATE LLC (2019-07-22),Granted Patent,G06Q50/02;;G05B23/0254;;G05B19/042;;A01C21/007;;G05B13/0265;;A01B79/005;;A01G25/167;;A01C21/007;;G05B19/042;;G06Q50/02;;G01C21/30;;G05D1/0278;;G05B19/0415;;G06F30/27;;A01B79/005;;G05B13/0265;;G05B23/0254,A01G25/16;;A01B79/00;;A01C21/00;;G01C21/30;;G05B13/02;;G05B19/04;;G05B19/042;;G05B23/02;;G05D1/02;;G06F30/27;;G06Q50/02,ACTIVE,,,,
US,1/2/2020,2020,US 201816042015 A,AUTOMATICALLY ASSIGNING HYBRIDS OR SEEDS TO FIELDS FOR PLANTING,"Techniques are provided for automatically assigning hybrid products or seed products to agricultural fields with optimal yield performance. In one embodiment, a computer-implemented method comprises using field assignment instructions in the server computer system, receiving, over a digital data communication network at a server computer system, grower datasets specifying agricultural fields of growers and inventories of hybrid products or seed products of the growers; using the field assignment instructions in the server computer system, obtaining over the digital data communication network at the server computer system, other input data comprising relative maturity values, historic yield values for the fields of the growers, and mean yield values for regions in which the fields of the growers are located; using the field assignment instructions in the server computer system, calculating pair datasets consisting of permutations of product assignments of two (2) products to two (2) fields from among the fields of the growers, and corresponding converse assignments of the same products and fields; inputting specified features of the pair dataset(s) to a trained machine learning model, to yield predicted POS values for each of the product assignments and its corresponding converse assignment; blending the predicted POS values for all fields with field classification data using an operations research model of other field data, to result in creating and storing score values for each of the product assignments and the corresponding converse assignments; using the field assignment instructions in the server computer system, generating and causing displaying at least the product assignments in a graphical user interface display of a client computing device.",CLIMATE CORP,REICH TIMOTHY;;YANG XIAO;;EHLMANN TONYA;;BULL JASON;;XIE YAO;;SHAH NIKISHA;;SORGE MATTHEW,CLIMATE LLC (2018-08-14),Patent Application,A01B79/005;;G06Q50/02;;G06Q10/087;;G06Q10/04;;G06Q10/0631;;G06N20/20;;G06N20/10;;G06N3/006;;G06N3/126;;A01C21/00;;G06N5/01;;G06N5/04;;A01B79/005;;G06Q20/20;;G06N20/00,G06N5/04;;A01B79/00;;G06N99/00;;G06Q20/20,DISCONTINUED,,,,
WO,1/9/2020,2020,US 2019/0040073 W,AUTOMATICALLY ASSIGNING HYBRIDS OR SEEDS TO FIELDS FOR PLANTING,"Techniques are provided for assigning hybrid products or seed products to agricultural fields with optimal yield performance. In one embodiment, a method comprises receiving datasets specifying agricultural fields and inventories of hybrid products or seed products; obtaining input data comprising relative maturity values, historic yield values, and mean yield values for regions; calculating pair datasets consisting of permutations of product assignments and corresponding converse assignments of products and fields; inputting specified features of the pair dataset(s) to a trained machine learning model to yield POS values for each of the product assignments and its corresponding converse assignment; blending the POS values with field classification data using an operations research model to result in creating and storing score values for each of the product assignments and the corresponding converse assignments; generating and causing displaying at least the product assignments in a graphical user interface display of a client computing device.",CLIMATE CORP,REICH TIMOTHY;;YANG XIAO;;EHLMANN TONYA;;BULL JASON;;XIE YAO;;SHAH NIKISHA;;SORGE MATTHEW,,Patent Application,A01B79/005;;G06Q50/02;;G06Q10/087;;G06Q10/04;;G06Q10/0631;;G06N20/20;;G06N20/10;;G06N3/006;;G06N3/126;;A01C21/00;;G06N5/01;;G06N5/04;;A01B79/005;;G06Q20/20;;G06N20/00,G06Q40/00,PENDING,,,,
EP,7/14/2021,2021,EP 18215641 A,TECHNIQUES FOR AUTOMATED PLANTING,,BIOCARBON ENG LTD;;FLETCHER LAUREN E;;RITCHIE MATTHEW S;;GRAHAM SUSAN M,FLETCHER LAUREN E;;RITCHIE MATTHEW S;;GRAHAM SUSAN M;;BIAN SHUNNING,"GRAHAM, SUSAN M. (2021-06-23);;RITCHIE, MATTHEW S. (2021-06-23);;FLETCHER, LAUREN E. (2021-06-23);;BIOCARBON ENGINEERING LTD. (2021-06-23)",Granted Patent,A01C21/005;;A01G9/0293;;B64D1/08;;B64C39/024;;B64D1/16;;A01B79/005;;B64U2101/60;;B64U10/13;;B64U2201/10;;B64U2101/00;;Y02P60/21;;A01C21/005;;A01G9/0293;;B64D1/08;;B64C39/024;;B64D1/16;;B64U10/13;;B64U2101/00;;B64U2101/60;;B64U2201/10;;A01B79/005,A01B69/04;;A01B49/06;;A01B79/00;;A01B79/02;;A01C7/08;;A01C21/00,ACTIVE,,,,
US,11/17/2016,2016,US 201615001112 A,APPARATUSES AND METHODS FOR BIO-SENSING USING UNMANNED AERIAL VEHICLES,"Described herein are methods, apparatuses, and systems that enable a light weight autonomous unmanned aerial vehicle (UAV) to process hyperspectral (HSI) data during its flight and send information to the ground computer via radio-link. This capability is not currently available owing to the severe combination of technical constraints: the typical processing power required to analyze HSI data in real time; the small space and power available for the payload in a light-weight UAV; and the limited bandwidth available on the wireless link.",BIOSENSING SYSTEMS LLC,PLUVINAGE VINCENT,BIOSENSING SYSTEMS LLC (2018-07-05),Patent Application,G01J3/0264;;G01J3/28;;G01J3/027;;G01J3/2823;;G01N33/025;;B64C39/024;;A01G25/16;;B64U2101/30;;G01J3/2823;;G01N33/025;;G01J3/0297;;B64C39/024;;G01J3/0264;;G01J3/28;;G01J3/027;;B64U2101/30,G01J3/28;;A01G25/16;;B64C39/02;;G01J3/02;;G01N33/02;;G05B15/02,INACTIVE,,,,
US,4/20/2023,2023,US 202218061396 A,Dynamic Vision System for Robot Fleet Management,A dynamic vision system for robot fleet management includes an optical assembly including a lens containing a liquid. The lens is deformable to generate variable focus for the lens. The optical assembly is configured to capture optical data. The dynamic vision system includes a robot fleet management platform having a control system configured to adjust one or more optical parameters. The one or more optical parameters modify the variable focus of the lens while the optical assembly captures current optical data relating to a robotic fleet. The dynamic vision system includes a processing system configured to train a machine learning model to recognize an object relating to the robotic fleet using training data generated from the optical data captured by the optical assembly. The optical data includes the current optical data relating to the robotic fleet.,STRONG FORCE VCN PORTFOLIO 2019 LLC,MARINKOVICH SAVA;;CELLA CHARLES H;;BLIVEN BRENT;;DOBROWITSKY JOSHUA;;CARDNO ANDREW;;SHARMA KUNAL;;KELL BRAD,STRONG FORCE VCN PORTFOLIO 2019 LLC (2022-12-14),Patent Application,G06Q10/087;;G06F16/182;;G06F16/2455;;G06Q10/087;;G05B19/4099;;G05B2219/49023;;G06F16/27;;G06F16/2462;;G06Q30/0202;;G06Q30/0206;;G05B19/41865;;G05B19/4188;;G06Q20/389;;G06V10/774;;H04N23/675;;G05D1/0246;;G05D1/0291,G06V10/774;;G05D1/02;;H04N23/67,PENDING,,,,
US,4/23/2020,2020,US 201916657957 A,MACHINE LEARNING TECHNIQUES FOR IDENTIFYING CLOUDS AND CLOUD SHADOWS IN SATELLITE IMAGERY,"Systems and methods for identifying clouds and cloud shadows in satellite imagery are described herein. In an embodiment, a system receives a plurality of images of agronomic fields produced using one or more frequency bands. The system also receives corresponding data identifying cloud and cloud shadow locations in the images. The system trains. a machine learning system to identify at least cloud locations using the images as inputs and at least data identifying pixels as cloud pixels or non-cloud pixels as outputs. When the system receives one or more particular images of a particular agronomic field produced using the one or more frequency bands, the system uses the one or more particular images as inputs into the machine learning system to identify a plurality of pixels in the one or more particular images as particular cloud locations.",CLIMATE CORP,SHE YING;;KHADKA PRAMITHUS;;GUAN WEI;;YANG XIAOYUAN;;DEVECIGIL DEMIR,CLIMATE LLC (2019-11-01),Patent Application,G06N3/08;;G06T5/005;;G06T7/11;;G06T2207/10032;;G06T2207/20084;;G06T2207/30188;;G06Q50/02;;G06Q10/067;;G06V20/188;;G06V10/764;;G06N3/045;;G06F17/16;;G06N20/00;;G06V20/188;;G06N3/045;;G06T5/005;;G06V10/764,G06K9/00;;G06F17/16;;G06N3/04;;G06N20/00,ACTIVE,,,,
WO,5/7/2020,2020,US 2019/0059206 W,AUTOMATED SAMPLE COLLECTION AND TRACKING SYSTEM,"In an embodiment, a computer-implemented method of tracking soil sampling in a field is disclosed. The method comprises receiving, by a processor, digitally stored field map data and digitally stored sampling data. The method further comprises displaying, by the processor, a field map depicting the first set of sampling points in a computer-generated graphical user interface. In addition, the method comprises receiving a selection of a first sampling point and displaying first sampling data associated with the first sampling point. The method also comprises receiving an update indicating that a soil sample has been collected at the first sampling point. Finally, the method comprises determining a second sampling point at which a next soil sample is to be collected and displaying the second sampling point in the field map.",CLIMATE CORP,LEWIS MICHAEL;;FRISS SHALOM;;DHARNA JYOTI;;AULBACH CHRISTOPHER;;SONTHEIMER JASON;;KHAN ATIF,,Patent Application,G01N33/24;;G01N2033/245;;G06Q50/02;;G01N2001/021;;G01N1/02;;A01B79/005;;A01B79/02;;A01B79/005;;G01N33/24;;G01N1/02;;G01N2033/245;;G06F3/0482;;G01N2001/021;;G06Q50/02,A01B79/02;;G06Q10/08;;G06Q50/02,PENDING,,,,
US,4/30/2020,2020,US 201916670247 A,AUTOMATED SAMPLE COLLECTION AND TRACKING SYSTEM,"In an embodiment, a computer-implemented method of tracking soil sampling in a field is disclosed. The method comprises receiving, by a processor, digitally stored field map data and digitally stored sampling data. The method further comprises displaying, by the processor, a field map depicting the first set of sampling points in a computer-generated graphical user interface. In addition, the method comprises receiving a selection of a first sampling point and displaying first sampling data associated with the first sampling point. The method also comprises receiving an update indicating that a soil sample has been collected at the first sampling point. Finally, the method comprises determining a second sampling point at which a next soil sample is to be collected and displaying the second sampling point in the field map.",CLIMATE CORP,LEWIS MICHAEL DAVID;;FRISS SHALOM;;DHARNA JYOTI;;AULBACH CHRISTOPHER P;;SONTHEIMER JASON R;;KHAN ATIF,CLIMATE LLC (2019-11-05),Patent Application,G01N33/24;;G01N2033/245;;G06Q50/02;;G01N2001/021;;G01N1/02;;A01B79/005;;A01B79/02;;A01B79/005;;G01N33/24;;G01N1/02;;G01N2033/245;;G06F3/0482;;G01N2001/021;;G06Q50/02,A01B79/00;;G01N1/02;;G01N33/24;;G06F3/0482;;G06Q50/02,PENDING,,,,
WO,4/23/2020,2020,US 2019/0056895 W,MACHINE LEARNING TECHNIQUES FOR IDENTIFYING CLOUDS AND CLOUD SHADOWS IN SATELLITE IMAGERY,"Systems and methods for identifying clouds and cloud shadows in satellite imagery are described herein. In an embodiment, a system receives a plurality of images of agronomic fields produced using one or more frequency bands. The system also receives corresponding data identifying cloud and cloud shadow locations in the images. The system trains. a machine learning system to identify at least cloud locations using the images as inputs and at least data identifying pixels as cloud pixels or non-cloud pixels as outputs. When the system receives one or more particular images of a particular agronomic field produced using the one or more frequency bands, the system uses the one or more particular images as inputs into the machine learning system to identify a plurality of pixels in the one or more particular images as particular cloud locations.",CLIMATE CORP,SHE YING;;KHADKA PRAMITHUS;;GUAN WEI;;YANG XIAOYUAN;;DEVECIGIL DEMIR,,Patent Application,G06N3/08;;G06T5/005;;G06T7/11;;G06T2207/10032;;G06T2207/20084;;G06T2207/30188;;G06Q50/02;;G06Q10/067;;G06V20/188;;G06V10/764;;G06N3/045;;G06F17/16;;G06N20/00;;G06V20/188;;G06N3/045;;G06T5/005;;G06V10/764,G06T7/162;;G06T7/174;;G06T7/41;;G06T7/529;;G06T7/60,PENDING,,,,
US,9/22/2020,2020,US 202016862093 A,Crop management method and apparatus with autonomous vehicles,"In some embodiments, a method for managing growing crops in a crop growing farm includes operating one or more unmanned aerial vehicles (UAV) to fly over a plurality of sections of a crop growing farm. The UAVs are fitted with a plurality of cameras equipped to generate images in a plurality of spectrums. The plurality of sections of the crop growing farm grow crops of one or more types or varietals. The method further includes taking a plurality of aerial images of the sections of the vineyard in the plurality of spectrums, using the plurality of cameras, while the UAVs are flying over the plurality of sections of the crop growing farm, and executing an analyzer on a computing system to machine analyze the plurality of aerial images for anomalies associated with growing the crops of the one or more types or varietals. The machine analysis takes into consideration topological information of the crop growing farm, as well as current planting information of the crop growing farm.",POLLEN SYSTEMS CORP,MCCALL KEITH;;NELSON TRINA,POLLEN SYSTEMS CORPORATION (2020-04-24),Granted Patent,G06Q50/02;;A01G7/00;;G06V20/194;;G06V20/188;;G06V10/454;;G06V20/17;;G06V10/82;;G06V10/764;;B64U2101/30;;A01G7/00;;G06Q50/02;;B64C39/024;;G06V20/10;;G06V20/188;;G06V20/194;;B64U2101/30;;G06V10/764;;G06V10/82;;G06V10/454;;G06V20/17,A01G17/02;;A01G7/00;;B64C39/02;;G06K9/00;;G06Q50/02,ACTIVE,,,,
US,8/13/2020,2020,US 202016862093 A,CROP MANAGEMENT METHOD AND APPARATUS WITH AUTONOMOUS VEHICLES,"In some embodiments, a method for managing growing crops in a crop growing farm includes operating one or more unmanned aerial vehicles (UAV) to fly over a plurality of sections of a crop growing farm. The UAVs are fitted with a plurality of cameras equipped to generate images in a plurality of spectrums. The plurality of sections of the crop growing farm grow crops of one or more types or varietals. The method further includes taking a plurality of aerial images of the sections of the vineyard in the plurality of spectrums, using the plurality of cameras, while the UAVs are flying over the plurality of sections of the crop growing farm, and executing an analyzer on a computing system to machine analyze the plurality of aerial images for anomalies associated with growing the crops of the one or more types or varietals. The machine analysis takes into consideration topological information of the crop growing farm, as well as current planting information of the crop growing farm.",POLLEN SYSTEMS CORP,MCCALL KEITH;;NELSON TRINA,POLLEN SYSTEMS CORPORATION (2020-04-24),Patent Application,G06Q50/02;;A01G7/00;;G06V20/194;;G06V20/188;;G06V10/454;;G06V20/17;;G06V10/82;;G06V10/764;;B64U2101/30;;A01G7/00;;G06Q50/02;;B64C39/024;;G06V20/10;;G06V20/188;;G06V20/194;;B64U2101/30;;G06V10/764;;G06V10/82;;G06V10/454;;G06V20/17,A01G7/00;;B64C39/02;;G06K9/00;;G06Q50/02,ACTIVE,,,,
US,8/4/2022,2022,US 202217722130 A,"Systems, Methods, Kits, and Apparatuses for Digital Product Network Systems and Biology-Based Value Chain Networks","A digital product network system generally includes a set of digital products each having a product memory, a product network interface, and a product processor programmed with product instructions; a product network control tower having a control tower memory, a control tower network interface, and a control tower processor programmed with control tower instructions; and a digital twin system defined at least in part by at least one of the product instructions or the control tower instructions to encode a set of digital twins representing the set of digital products.",STRONG FORCE VCN PORTFOLIO 2019 LLC,CELLA CHARLES HOWARD;;CARDNO ANDREW;;PARENTI JENNA;;LOCKE ANDREW S,STRONG FORCE VCN 2019 PORTFOLIO LLC (2023-01-09),Patent Application,G06Q10/087;;G06F9/451;;G06Q10/087,G06Q10/08;;G06F9/451,PENDING,,,,
