Jurisdiction,Publication Date,Publication Year,Application Number,Title,Abstract,Applicants,Inventors,Owners,Document_type,CPC_classification,IPCR Classifications,legal_status
US,2/2/2017,2017,US 201615146342 A,"INVENTORY, GROWTH, AND RISK PREDICTION USING IMAGE PROCESSING","According to examples, inventory, growth, and risk prediction using image processing may include receiving a plurality of images captured by a vehicle during movement of the vehicle along a vehicle path. The images may include a plurality of objects. The images may be pre-processed for feature extraction. A plurality of features of the objects may be extracted from the pre-processed images by using a combination of computer vision techniques. A parameter related to the objects may be determined from the extracted features. A spatial density model may be generated, based on the determined parameter and the extracted features, to provide a visual indication of density of distribution of the objects related to a portion of the images, and/or to provide an alert corresponding to the objects related to the portion of the images.",ACCENTURE GLOBAL SERVICES LTD,MANNAR KAMAL;;RAMANI SENTHIL;;BHANDARI MANIK;;WANG ANDREA HUANHUAN;;BALASUNDARAM UVARAJ,ACCENTURE GLOBAL SERVICES LIMITED (2015-07-31),Patent Application,G06T5/002;;G06T2207/30188;;G06V20/188;;G06V10/25;;G06V10/507;;G06V10/56;;G06V10/462;;G06V10/751;;G06T7/73;;G06T7/90;;G06V20/80;;G06V40/193;;G06V20/13;;G06V20/56;;G06T7/73;;G06T7/90;;G06V20/13;;G06V20/56;;G06V20/80;;G06V40/193;;G06F18/24;;G06T5/00;;G06T7/0002;;G06T7/60;;G06T11/206;;G06T2207/20024;;G06T2207/20192;;G06T2207/30188,G06T7/00;;G06K9/46;;G06K9/52;;G06K9/62;;G06T5/00;;G06T7/40;;G06T7/60;;G06T11/20,ACTIVE,,,,
US,9/20/2012,2012,US 201213421659 A,AUTOMATIC OBSTACLE LOCATION MAPPING,A method of automatic obstacle location mapping comprises receiving an indication of a feature to be identified in a defined area. An instance of the feature is found within an image. A report is then generated conveying the location of said feature.,LANGE ARTHUR F;;CASH MICHAEL;;BRINGUEL MARIN C;;LINDORES ROBERT J;;WEISENBURGER SHAWN D;;FRANCE PETER G;;JANKY JAMES M,LANGE ARTHUR F;;CASH MICHAEL;;BRINGUEL MARIN C;;LINDORES ROBERT J;;WEISENBURGER SHAWN D;;FRANCE PETER G;;JANKY JAMES M,TRIMBLE NAVIGATION LIMITED (2012-02-16),Patent Application,G06F16/29;;A01B79/005;;G06V20/58;;G06V20/68;;G06F16/29;;G06V20/58;;G06V20/68,G06K9/46,ACTIVE,,,,
US,10/25/2022,2022,US 201916659712 A,Agricultural zone management system and variable rate prescription generation,"An agricultural zone management system and methods where a variable rate prescription (VRP) includes a plurality of equipment zones of the agricultural field that are generated based on at least one treatment dimension of a farm implement to be used in the agricultural field, and each one of the equipment zones is further defined based on one or more of an intended direction of travel of the farm implement in the agricultural field, and an intended travel path of the farm implement in the agricultural field. In addition, a treatment plan, such as a treatment rate, can be generated based on the needs of plants, soil or the like in each equipment zone.",SENTERA INC,MUEHLFELD ANDREW,SENTERA INC (2019-10-21),Granted Patent,A01M7/0089;;A01C21/005;;A01B79/005;;G05D2201/0201;;G05D1/0246;;G05D1/0219,A01B63/00;;A01B79/00;;A01C1/00;;A01C14/00;;A01C21/00;;A01C23/00;;G01C21/36;;G05D1/02,ACTIVE,,,,
US,7/22/2021,2021,US 202117198257 A,"MACHINE LEARNING IN AGRICULTURAL PLANTING, GROWING, AND HARVESTING CONTEXTS","A crop prediction system performs various machine learning operations to predict crop production and to identify a set of farming operations that, if performed, optimize crop production. The crop prediction system uses crop prediction models trained using various machine learning operations based on geographic and agronomic information. Responsive to receiving a request from a grower, the crop prediction system can access information representation of a portion of land corresponding to the request, such as the location of the land and corresponding weather conditions and soil composition. The crop prediction system applies one or more crop prediction models to the access information to predict a crop production and identify an optimized set of farming operations for the grower to perform.",INDIGO AG INC,PERRY DAVID PATRICK;;VON MALTZAHN GEOFFREY ALBERT;;BERENDES ROBERT;;JECK ERIC MICHAEL;;KNIGHT BARRY LOYD;;RAYMOND RACHEL ARIEL;;TRIVISVAVET PONSI;;WONG JUSTIN Y H;;RAJDEV NEAL HITESH;;MEUNIER MARC-CEDRIC JOSEPH;;LEIST CASEY JAMES;;TADI PRANAV RAM;;FLAHERTY ANDREA LEE;;BRUMMITT CHARLES DAVID;;SINHA NAVEEN NEIL;;LAMBERT JORDAN;;HENNEK JONATHAN;;BECCO CARLOS;;ALLEN MARK;;BACHNER DANIEL;;DEROSSI FERNANDO;;LAMONT EWAN;;LOWENTHAL ROB;;CREAGH DAN;;ABRAMSON STEVE;;ALLEN BEN;;SHANKAR JYOTI;;MOSCARDINI CHRIS;;CRANE JEREMY;;WEISMAN DAVID;;KEATING GERARD;;MOORES LAUREN;;PATE WILLIAM,INDIGO AG INC (2018-08-13),Patent Application,A01B79/005;;A01B79/02;;A01C21/00;;G06Q10/04;;G06Q50/02;;Y02A40/28;;G06V20/188;;A01B79/005;;A01B79/02;;A01C21/00;;G06F18/217;;G06Q10/04;;G06Q50/02,G06Q50/02;;A01B79/00;;A01B79/02;;A01C21/00;;G06K9/00;;G06K9/42;;G06K9/62;;G06Q10/04,PENDING,,,,
US,3/8/2022,2022,US 201916665633 A,Cognitive decision platform for honey value chain,"In an aspect, a decision platform that optimizes honey value chain can be provided. The decision platform may receive images of a geographic region including catchment areas, run a first machine learning model with the images as input to identify resources in the catchment areas, run a second machine learning model with the identified resources to predict pollen and nectar concentration in the catchment areas, run a third machine learning model with at least the predicted pollen and nectar concentration to predict honey yield in each of the catchment areas, and determine placement of a swarm to at least one of the catchment areas. The decision platform may also control an unmanned aerial vehicle to guide the swarm to at least one of the catchment areas.",IBM,WACHIRA CHARLES MUCHIRI;;BORE NELSON KIBICHII;;WELDEMARIAM KOMMINIST;;TER-MINASSIAN LUCILE,INTERNATIONAL BUSINESS MACHINES CORPORATION (2019-10-03),Granted Patent,A01K57/00;;G06N3/08;;G06N5/022;;G06N20/10;;G06V20/176;;G06V2201/07;;G06V20/17;;G06V10/82;;G06V10/764;;G06N3/045;;G06N3/044;;B64U2101/30;;B64C39/024;;A01K57/00;;G06N3/08;;G06N3/045;;G06V10/764;;G06V10/82;;G06V20/17;;G06V20/176,G06N3/04;;A01K57/00;;B64C39/02;;G06K9/00;;G06N3/08,ACTIVE,,,,
US,11/5/2020,2020,US 201716771344 A,"Evaluation Information Generation System, Evaluation Information Generation Method, and Program","The evaluation information generating system of the present invention evaluates a ground area owned by a user, using satellite data observed by an artificial satellite, and includes a user information acquisition unit that acquires user information that is personal information of the user, a ground area information acquisition unit that acquires ground area information including a position of the ground area, a satellite data acquisition unit that acquires the satellite data, a situation detection unit that detects a situation of the ground area based on the satellite data, and an evaluation data generating unit that generates evaluation data of the user or the ground area based on the user information, ground area information, and situation of the ground area.",SKY PERFECT JSAT CORP,HIRATA DAISUKE,SKY PERFECT JSAT CORPORATION (2020-04-30),Patent Application,G06Q40/02;;G06Q50/02;;G06Q30/018;;G06N20/00;;G06Q40/03;;G06Q30/018;;G06T7/174;;G06T2207/30188;;G06T2207/10032;;G06T2207/10036;;G06F2218/08;;G06F2218/12;;G06Q40/03,G06Q30/00;;G01C11/04;;G06N5/04;;G06N20/00;;G06Q40/02;;G06Q50/02;;H04B10/29,ACTIVE,,,,
US,11/8/2022,2022,US 201716771344 A,"Evaluation information generation system, evaluation information generation method, and program","The evaluation information generating system of the present invention evaluates a ground area owned by a user, using satellite data observed by an artificial satellite, and includes a user information acquisition unit that acquires user information that is personal information of the user, a ground area information acquisition unit that acquires ground area information including a position of the ground area, a satellite data acquisition unit that acquires the satellite data, a situation detection unit that detects a situation of the ground area based on the satellite data, and an evaluation data generating unit that generates evaluation data of the user or the ground area based on the user information, ground area information, and situation of the ground area.",SKY PERFECT JSAT CORP,HIRATA DAISUKE,SKY PERFECT JSAT CORPORATION (2020-04-30),Granted Patent,G06Q40/02;;G06Q50/02;;G06Q30/018;;G06N20/00;;G06Q40/03;;G06Q30/018;;G06T7/174;;G06T2207/30188;;G06T2207/10032;;G06T2207/10036;;G06F2218/08;;G06F2218/12;;G06Q40/03,G06K9/00;;G06Q30/00;;G06Q40/02;;G06T7/174,ACTIVE,,,,
US,10/29/2020,2020,US 202016845225 A,YIELD FORECASTING USING CROP SPECIFIC FEATURES AND GROWTH STAGES,"A method for predicting crop yield of an agricultural field may include steps of applying a pre-season model to provide a pre-season model crop yield prediction, applying an in-season model to provide an in-season model crop yield prediction, applying a statistical imagery model to provide a statistical imagery model crop yield prediction, applying a histogram-based image model to provide a histogram-based image model crop yield prediction, applying crop-specific models to provide at least one crop-specific model crop yield prediction, and combining at a computing system crop yield predictions from a plurality of models within a set comprising the pre-season model, the in-season model, the statistical imagery model, the histogram-based image model, and the crop-specific models, to produce a final crop yield prediction.",FARMERS EDGE INC,BENGTSON JACOB WALKER;;BRYANT CHAD RICHARD;;XIAN CHANGCHI;;CUELL CHARLES;;SCHOLTEN KEILAN;;ZOHRA FATEMA TUZ,FARMERS EDGE INC (2019-04-23),Patent Application,G06Q10/04;;G06N3/08;;G06V20/188;;G06V10/50;;G06V10/462;;G06V10/82;;G06N3/045;;G06Q10/04;;G06N3/08;;G06V20/188;;G06F18/217;;G06N3/045;;G06V10/82;;G06V10/462;;G06V10/50,G06K9/00;;G06K9/62;;G06N3/04;;G06N3/08;;G06Q10/04,ACTIVE,,,,
WO,10/29/2020,2020,CA 2020050369 W,YIELD FORECASTING USING CROP SPECIFIC FEATURES AND GROWTH STAGES,"A method for predicting crop yield of an agricultural field may include steps of applying a pre-season model to provide a pre-season model crop yield prediction, applying an in-season model to provide an in-season model crop yield prediction, applying a statistical imagery model to provide a statistical imagery model crop yield prediction, applying a histogram-based image model to provide a histogram-based image model crop yield prediction, applying crop-specific models to provide at least one crop- specific model crop yield prediction, and combining at a computing system crop yield predictions from a plurality of models within a set comprising the pre-season model, the in-season model, the statistical imagery model, the histogram-based image model, and the crop-specific models, to produce a final crop yield prediction.",FARMERS EDGE INC,BENGTSON JACOB WALKER;;BRYANT CHAD RICHARD;;XIAN CHANGCHI;;CUELL CHARLES;;SCHOLTEN KEILAN;;ZOHRA FATEMA TUZ,,Patent Application,G06Q10/04;;G06N3/08;;G06V20/188;;G06V10/50;;G06V10/462;;G06V10/82;;G06N3/045;;G06Q10/04;;G06N3/08;;G06V20/188;;G06F18/217;;G06N3/045;;G06V10/82;;G06V10/462;;G06V10/50,G06Q10/04;;G06Q50/02,PENDING,,,,
US,5/3/2022,2022,US 202016845225 A,Yield forecasting using crop specific features and growth stages,"A method for predicting crop yield of an agricultural field may include steps of applying a pre-season model to provide a pre-season model crop yield prediction, applying an in-season model to provide an in-season model crop yield prediction, applying a statistical imagery model to provide a statistical imagery model crop yield prediction, applying a histogram-based image model to provide a histogram-based image model crop yield prediction, applying crop-specific models to provide at least one crop-specific model crop yield prediction, and combining at a computing system crop yield predictions from a plurality of models within a set comprising the pre-season model, the in-season model, the statistical imagery model, the histogram-based image model, and the crop-specific models, to produce a final crop yield prediction.",FARMERS EDGE INC,BENGTSON JACOB WALKER;;BRYANT CHAD RICHARD;;XIAN CHANGCHI;;CUELL CHARLES;;SCHOLTEN KEILAN;;ZOHRA FATEMA TUZ,FARMERS EDGE INC (2019-04-23),Granted Patent,G06Q10/04;;G06N3/08;;G06V20/188;;G06V10/50;;G06V10/462;;G06V10/82;;G06N3/045;;G06Q10/04;;G06N3/08;;G06V20/188;;G06F18/217;;G06N3/045;;G06V10/82;;G06V10/462;;G06V10/50,G06K9/00;;G06K9/62;;G06N3/04;;G06N3/08;;G06Q10/04;;G06V20/10,ACTIVE,,,,
US,12/17/2020,2020,US 202017003914 A,DETECTING INFECTION OF PLANT DISEASES BY CLASSIFYING PLANT PHOTOS,"A system and processing methods for configuring and utilizing a convolutional neural network (CNN) for plant disease recognition are disclosed. In some embodiments, the system is programmed to collect photos of infected plants or leaves where regions showing symptoms of infecting diseases are marked. Each photo may have multiple marked regions. Depending on how the symptoms are sized or clustered, one marked region may include only one lesion caused by one disease, while another may include multiple, closely-spaced lesions caused by one disease. The system is programmed to determine anchor boxes having distinct aspect ratios from these marked regions for each convolutional layer of a single shot multibox detector (SSD). For certain types of plants, common diseases lead to relatively many aspect ratios, some having relatively extreme values. The system is programmed to then train the SSD using the marked regions and the anchor boxes and apply the SSD to new photos to identify diseased plants.",CLIMATE CORP,GUI YICHUAN;;GUAN WEI,CLIMATE LLC (2019-10-23),Patent Application,G01N33/0098;;G06N3/08;;G06N3/006;;G06N3/126;;G06V20/38;;G06V10/82;;G06V20/188;;G06V10/764;;G06N3/045;;G01N33/0098;;G06N3/08;;G06F18/23;;G06F18/2431;;G06V10/764;;G06V10/82;;G06V20/188;;G06V20/38,G01N33/00;;G06K9/62;;G06N3/08,PENDING,,,,
US,8/25/2015,2015,US 201213568109 A,"Methods, apparatus, and systems for determining in-season crop status in an agricultural crop and alerting users","A crop's status may be determined from analysis of information regarding the crop received from, for example, a user, an in-season data gathering source, a database, a data feed, an aerial sensor, a UAV, and/or a remote sensor via a communication network. The received data may be compared to, for example, a benchmark, a parameter, a previously determined crop status, and/or a baseline associated with the crop and the comparison may be scored. When the score exceeds a predetermined threshold, an alert may be generated and provided to a user via the communication network.",JOHNSON JEROME DALE;;SUPERIOR EDGE INC,JOHNSON JEROME DALE,SUPERIOR EDGE INC (2012-08-06),Granted Patent,A01B79/005;;A01B79/005;;A01C21/007;;G06F3/0484;;G06F16/22;;G06F16/22;;G06F16/24578;;G06F16/24578;;G06F16/248;;G06F16/248;;G06F16/285;;G06F16/285;;G08B21/18;;H04L65/403,G01W1/00;;A01B79/00;;A01G1/00,ACTIVE,,,,
US,12/15/2015,2015,US 201213421659 A,Automatic obstacle location mapping,A method of automatic obstacle location mapping comprises receiving an indication of a feature to be identified in a defined area. An instance of the feature is found within an image. A report is then generated conveying the location of said feature.,LANGE ARTHUR F;;CASH MICHAEL;;BRINGUEL MARTIN C;;LINDORES ROBERT J;;WEISENBURGER SHAWN D;;FRANCE PETER G;;JANKY JAMES M;;TRIMBLE NAVIGATION LTD,LANGE ARTHUR F;;CASH MICHAEL;;BRINGUEL MARTIN C;;LINDORES ROBERT J;;WEISENBURGER SHAWN D;;FRANCE PETER G;;JANKY JAMES M,TRIMBLE NAVIGATION LIMITED (2012-02-16),Granted Patent,G06F16/29;;A01B79/005;;G06V20/58;;G06V20/68;;G06F16/29;;G06V20/58;;G06V20/68,G06K9/00;;G06F17/30,ACTIVE,,,,
US,10/8/2019,2019,US 201715688567 A,Crop disease recognition and yield estimation,"In an embodiment, a computer-implemented method is disclosed. The method comprises causing a camera to continuously capture surroundings to generate multiple images and causing a display device to continuously display the multiple images as the multiple images are generated. In addition, the method comprises processing each of one or more of the multiple images. The processing comprises identifying at least one of a plurality of diseases and calculating at least one disease score associated with the at least one disease for a particular image; causing the display device to display information regarding the at least one disease and the at least one disease score in association with a currently displayed image; receiving input specifying one or more of the at least one disease; and causing the display device to show additional data regarding the one or more diseases, including a remedial measure for the one or more diseases.",CLIMATE CORP,BEDOYA JUAN PABLO;;STUBER VICTOR;;GUILLEMETTE GERARD;;KEMINK JOOST;;CHEN YAQI;;WILLIAMS DANIEL;;SHE YING;;FARAH MARIAN;;BOSHARD JULIAN;;GUAN WEI,THE CLIMATE CORPORATION (2018-09-04),Granted Patent,A01G7/06;;A01B79/005;;G06Q50/02;;G06V20/188;;G06Q50/02;;A01D41/1273;;G01D21/02;;A01D91/00;;A01G22/00;;A01B79/005;;A01G7/06;;G06V20/188,G06K9/00;;A01B79/00;;A01D41/127;;A01D91/00;;A01G7/06;;A01G22/00;;G01D21/02;;G06K9/46;;G06K9/68;;G06Q50/02,ACTIVE,,,,
US,5/6/2021,2021,US 202017112503 A,CONTROL TOWER AND ENTERPRISE MANAGEMENT PLATFORM WITH A MACHINE LEARNING/ARTIFICIAL INTELLIGENCE MANAGING SENSOR AND THE CAMERA FEEDS INTO DIGITAL TWIN,"An information technology generally including a set of monitoring facilities that are configured to monitor the value chain network entities; a set of applications that are configured to direct an enterprise to manage the value chain network entities of the platform from a point of origin to a point of customer use; and a machine learning/artificial intelligence system configured to generate recommendations for placing at least one of an additional sensor and a camera on and/or in proximity to a value chain network entity of the value chain network entities, and wherein data from the at least one of the additional sensor and the camera feeds into a digital twin that represents the value chain network entities.",STRONG FORCE VCN PORTFOLIO 2019 LLC,CELLA CHARLES HOWARD;;SPITZ RICHARD;;EL-TAHRY TEYMOUR S,,Patent Application,G06Q10/0834;;G06Q10/0635;;G06Q10/0637;;G06Q10/087;;G06Q30/0635;;H04L9/3239;;H04L2209/56;;G05B2219/31229;;Y02P90/90;;G06N20/20;;G06N5/025;;G06N3/126;;G06N20/10;;G06N3/088;;G06N3/006;;G06N5/022;;G06N3/084;;G06N3/049;;G06N5/04;;H04L9/50;;G06N5/01;;G06N3/047;;G06N7/01;;G06N3/044;;G06N3/045;;G06Q10/087;;G06N5/04;;G06N20/00;;G06Q10/0635;;G06Q10/0637;;G06Q10/0834;;G06Q30/0635;;H04L9/3236;;G05B19/042;;G05B2219/31229;;H04L9/50,G06Q10/08;;G06N5/04;;G06N20/00,PENDING,,,,
US,5/24/2022,2022,US 201515513126 A,Techniques for automated planting,"Embodiments of the present invention provide techniques, including systems and methods, for planting using planting pods. A planting system can be configured to deliver pods including a payload (e.g., seeds, cuttings, or other planting materials) into or onto the ground at a predetermined location. In some embodiments, the automated planting system can include a mapping system that receives various sensor inputs and generates a map of a planting area. A pod planting system may use the map of the planting area to deliver pods to the planting area. The pod planting system may be executed automatically using the maps generated by the mapping system and/or manually by a remote operator. Each pod can include a payload to be planted on or in the ground by the pod planting system. Pods may be customized depending on the types of plants being planted, the terrain, prior planting results, etc.",BIOCARBON ENG LTD;;FLETCHER LAUREN E;;RITCHIE MATTHEW S;;GRAHAM SUSAN M;;DENDRA SYSTEMS LTD,FLETCHER LAUREN E;;RITCHIE MATTHEW S;;GRAHAM SUSAN M;;BIAN SHUNING,DENDRA SYSTEMS LTD (2017-03-22),Granted Patent,A01C21/005;;A01G9/0293;;B64D1/08;;B64C39/024;;B64D1/16;;A01B79/005;;B64U2101/60;;B64U10/13;;B64U2201/10;;B64U2101/00;;Y02P60/21;;A01C21/005;;A01G9/0293;;B64D1/08;;B64C39/024;;B64D1/16;;B64U10/13;;B64U2101/00;;B64U2101/60;;B64U2201/10;;A01B79/005,A01C21/00;;A01B79/00;;A01G9/029;;B64C39/02;;B64D1/08;;B64D1/16,ACTIVE,,,,
US,3/30/2023,2023,US 202117485928 A,ADAPTIVELY ADJUSTING PARAMETERS OF EQUIPMENT OPERATING IN UNPREDICTABLE TERRAIN,"Implementations are disclosed for adaptively adjusting various parameters of equipment in unpredictable terrain, such as agricultural fields. In various implementations, edge computing device(s) may obtain a first image captured by vision sensor(s) transported across an agricultural field by a vehicle. The first image may depict plant(s) growing in the agricultural area. The edge computing device(s) may process the first image based on a machine learning model to generate agricultural inference(s) about the plant(s) growing in the agricultural area. The edge computing device(s) may determine a quality metric for the agricultural inference(s). While the vehicle continues to travel across the agricultural field, and based on the quality metric: the edge computing device(s) may trigger one or more hardware adjustments to one or more of the vision sensors, or one or more adjustments in an operation of the vehicle.",X DEV LLC,YAROSHENKO SERGEY;;LEVINE GABRIELLA;;GRANT ELLIOTT;;SILVA DANIEL RIBEIRO;;KANU LINDA;;EBONG FRANCIS,X DEVELOPMENT LLC (2021-09-24);;MINERAL EARTH SCIENCES LLC (2022-12-19),Patent Application,G06V10/993;;G06V20/188;;G05D1/0246;;G06Q50/02;;G05D2201/0201;;G06Q10/063;;G06N3/09;;G06V20/188;;A01B63/002;;A01B79/005;;G06N3/02,A01B79/00;;A01B63/00;;G06N3/02,PENDING,,,,
US,3/23/2023,2023,US 202217942065 A,Metal Additive Manufacturing for Value Chain Networks,"An information technology system for supporting additive manufacturing and value chain workflows includes a cloud-based metal additive manufacturing management platform including an artificial intelligence system configured to learn on a training set of outcomes, parameters, and data collected from one or more additive manufacturing nodes to optimize additive manufacturing and value chain processes and workflows. The information technology system includes a distributed ledger system configured to store data related to the manufacturing nodes.",STRONG FORCE VCN PORTFOLIO 2019 LLC,CELLA CHARLES HOWARD;;BLIVEN BRENT;;SHARMA KUNAL;;EL-TAHRY TEYMOUR S,STRONG FORCE VCN PORTFOLIO 2019 LLC (2022-12-02),Patent Application,Y02P80/10;;Y02P80/40;;G05D1/0297;;G05D2201/0216;;G05D1/0221;;G05B19/4099;;G05B17/02;;G05B2219/49023;;G05B2219/36252;;G02B3/14;;G06N3/006;;G06N3/088;;G06N3/084;;G06N20/10;;G06N5/025;;B33Y50/02;;G06N3/045;;G05B2219/49023;;G05B19/4099;;G06N20/20;;G02B3/14;;G02B26/00;;G05B17/02;;G05D1/0297;;B25J9/161;;B25J9/163;;B25J9/1653;;B25J9/1697;;B33Y10/00;;B33Y50/02;;B29C64/393;;G06N20/00;;H04L9/50;;H04L9/3239;;G06Q10/06311;;G06F30/27;;G06F2113/10;;G05B13/0265;;G05B13/042;;G06Q30/0201;;G05D1/0027;;G06Q10/0631;;G06Q10/0831;;G06Q10/0833;;G06Q10/087;;B25J9/1661;;B25J9/1671;;B25J9/1682;;G06Q10/06;;G06Q10/0633;;G06Q10/06313;;G06Q20/14,G05B13/02;;G05B13/04;;G06F30/27;;G06Q30/0201,PENDING,,,,
WO,12/19/2019,2019,CA 2019050833 W,PRECISION AGRICULTURE SYSTEM AND RELATED METHODS,"The present disclosure relates to a precision agriculture system and related methods. In one aspect, there is a growing system comprising: a plurality of sensors for sensing one or both of parameters of a plant or parameters of an environment in which the plant is being grown; an environmental control system for controlling one or more growing conditions of the plant; a controller coupled to the plurality of sensors and configured to: receive sensor data from the plurality of sensors; determine whether parameters based at least in part on the sensor data match one or more performance criteria; and cause the environmental control system to perform an adjustment to at least one growing condition of the plant in response to a determination that the parameters do not match the one or more performance criteria.",PAIGE GROWTH TECH INC,MARTIN STEVEN;;GONZALEZ JAIME;;DI PIETRO EMIDIO;;DI PIETRO TONY;;HINDS DADRIAN;;ANDRADE KEVIN,,Patent Application,G06Q50/02;;G01N21/65;;G01N15/06;;G06Q10/0639;;A01G9/249;;A01G9/246;;A01G9/18;;A01G9/006;;A01G9/143;;G01N21/31;;G01N2021/8466;;G01N21/6486;;G01N2015/0046;;G01N2015/0065;;G06N3/126;;G06N3/084;;G01N33/0098;;Y02A40/10;;Y02A40/25;;G06N3/047;;G06N3/045,A01G7/00;;A01G22/00;;G06N20/00;;G06Q50/02,PENDING,,,,
